{
  "id": "canonical-unit-math-functions",
  "subject": "math",
  "title": "函數",
  "teachable": true,
  "gradeRange": [
    "7",
    "8",
    "9"
  ],
  "curriculumIds": [
    "cur-math-content-f-8-1",
    "cur-math-content-f-8-2",
    "cur-math-content-f-9-1",
    "cur-math-content-f-9-2",
    "cur-math-content-f",
    "cur-math-performance-f-iv-1",
    "cur-math-performance-f-iv-2",
    "cur-math-performance-f-iv-3",
    "cur-math-performance-f"
  ],
  "status": "mapped",
  "source": {
    "type": "official-curriculum",
    "url": "https://www.naer.edu.tw/upload/1/16/doc/815/%E5%8D%81%E4%BA%8C%E5%B9%B4%E5%9C%8B%E6%B0%91%E5%9F%BA%E6%9C%AC%E6%95%99%E8%82%B2%E8%AA%B2%E7%A8%8B%E7%B6%B1%E8%A6%81%E5%9C%8B%E6%B0%91%E4%B8%AD%E5%B0%8F%E5%AD%B8%E6%9A%A8%E6%99%AE%E9%80%9A%E5%9E%8B%E9%AB%98%E7%B4%9A%E4%B8%AD%E7%AD%89%E5%AD%B8%E6%A0%A1-%E6%95%B8%E5%AD%B8%E9%A0%98%E5%9F%9F.pdf",
    "locator": "PDF viewer P80-P81；國民中學八至九年級主題：函數（F）。",
    "verifiedAt": "2026-08-26",
    "confidence": "high"
  }
}
